### ISSUE TITLE
OS.EnableFirewall=y breaks load balanced sets probing...

### ISSUE THREAD

**Issue by rkirkpat** [Azure/WALinuxAgent#879]
We have several Ubuntu 14.04 LTS (classic) VMs in the Azure cloud running HTTPS web services on port 443. These web services are exposed to the Internet using load balanced sets with the probe port set also to be 443. Yesterday we upgraded these VMs with security updates, including an update of `walinuxagent` from v2.0.14 to v2.0.16, after which these web services were no longer accessible.

After much troubleshooting we discovered that the probes sent from Azure fabric IP, 168.63.129.16, were never getting a reply from our servers, as per this `tcpdump` output:
```
01:25:06.517671 IP 168.63.129.16.55780 > 10.0.0.6.https: Flags [SEW], seq 2458085120, win 8192, options [mss 1440,nop,wscale 8,nop,nop,sackOK], length 0
01:25:09.532881 IP 168.63.129.16.55780 > 10.0.0.6.https: Flags [SEW], seq 2458085120, win 8192, options [mss 1440,nop,wscale 8,nop,nop,sackOK], length 0
01:25:15.532769 IP 168.63.129.16.55780 > 10.0.0.6.https: Flags [S], seq 2458085120, win 8192, options [mss 1440,nop,nop,sackOK], length 0
```

We then proceeded to revert the updated packages one by one and eventually found that the updated `walinuxagent` package was the cause of failure. Reviewing `/etc/waagent.conf` we found a new config options, `OS.EnableFirewall`, and that it was enabled. Once we disabled that option and rebooted the server (on one that had not been downgraded), the web services were accessible again as the probe requests were getting responses now:
```
20:57:50.482060 IP 168.63.129.16.60021 > 10.0.0.6.https: Flags [SEW], seq 2427470624, win 8192, options [mss 1440,nop,wscale 8,nop,nop,sackOK], length 0
20:57:50.482113 IP 10.0.0.6.https > 168.63.129.16.60021: Flags [S.], seq 2514945281, ack 2427470625, win 29200, options [mss 1460,nop,nop,sackOK,nop,wscale 7], length 0
20:57:50.482157 IP 168.63.129.16.59962 > 10.0.0.6.https: Flags [.], ack 2, win 513, length 0
20:57:50.482276 IP 168.63.129.16.60021 > 10.0.0.6.https: Flags [.], ack 1, win 513, length 0
```

We reviewed the commits to the `waagent.conf` file on GitHub and found that a recent commit, e247e7b2f23cdf2fc754f8c95161c74853334a45, had added this option and firewall rules blocking any non-root process from communicating with the fabric server 168.63.129.16. Of course our web services on port 443 are not running as root (it is a custom twisted python service running as a service user) and hence are not allowed to receive the probe from the fabric. 

There was no warning about this change in any release notes, and it was enabled by default (in conflict with the comment directly above it in the config file that by default it was to be disabled). This issue cost us quite a bit of engineering time to find the solution and restore our web services. I would recommend this option be disabled by default or at least the user warned about it being enabled!

**Comment by brendandixon** [comment]
@rkirkpat We apologize that this caused you time and pain. The Azure fabric IP address is not meant for general consumption. Restricting access to the Linux Agent process (which is, effectively, what the `iptables` rules do) is the right thing.

What probe are your services dependent upon? I'm unaware of any probe from the Azure fabric into a service.

**Comment by fjjimenez01** [comment]
Hi, we experienced the same issue. After the WALinuxAgent update our web services and the web app were no longer available through the load balancer.

```
2017/09/09 05:08:19.253230 INFO WALinuxAgent-2.2.16 running as process 1129
2017/09/09 05:08:19.267546 INFO Wire server endpoint:168.63.129.16
2017/09/09 05:08:19.294151 INFO Wire server endpoint:168.63.129.16
2017/09/09 05:08:19.496409 INFO Wire server endpoint:168.63.129.16
2017/09/09 05:08:19.560777 INFO Successfully added Azure fabric firewall rules
```

We are not using Azure Fabric, the WALinuxAgent was installed by default.

**Comment by rkirkpat** [comment]
We are using load balanced sets as shown in this screen shot from the Azure portal after selecting one of (classic) VMs:
<img width="1550" alt="azureportal-loadbalancedset" src="https://user-images.githubusercontent.com/19275599/30243765-f2fae252-956d-11e7-99bf-4c52276c2776.png">

The probes are configured (highlighted with the red box) to verify our HTTPS web service is responding to connections before routing connections from the Internet to it. This way if we take a node down for maintenance connections will instead be routed to the remaining up nodes. We have been using this functionality without issue for a couple of years now.

**Comment by brendandixon** [comment]
Address by #883

**Comment by Suvitruf** [comment]
Not sure why it was closed, I've just deployed VM and in /etc/waagent.conf `OS.EnableFirewall=y` was enabled.

**Comment by hglkrijger** [comment]
@Suvitruf - the initial firewall rule was disabled because it was too restrictive, and hence this issue was closed. Since then we have started rolling out essentially the same functional change but with a less restrictive rule, which should not affect load balancer probes. Thanks for pointing out the comment in the config needs to be updated, I have opened #1260 for that.
